{
  "$schema": "task.schema.json",
  "id": "2025_mii_ht_b1",
  "name": "Schokoladenkugeln",
  "subject": "Mathematik",
  "topic": "Stochastik",
  "tags": [
    "abschlussprÃ¼fung",
    "realschule",
    "bayern",
    "2025",
    "stochastik",
    "baumdiagramm",
    "ohne zurÃ¼cklegen"
  ],
  "points": 5,
  "statement": "In einer Schale liegen 20 Schokoladenkugeln, die sich nur durch die FÃ¼llungen unterscheiden. Sechs Kugeln sind mit Nougat (â€žNâ€œ), fÃ¼nf mit Krokant (â€žKâ€œ) und die anderen mit Marzipan (â€žMâ€œ) gefÃ¼llt.",
  "parts": [
    {
      "id": "b1_1",
      "text": "Wilma hat sich zwei zufÃ¤llig ausgewÃ¤hlte Kugeln genommen und isst sie. VervollstÃ¤ndigen Sie das dazugehÃ¶rige Baumdiagramm.",
      "points": 2,
      "assets": [
        {
          "path": "assets/B1_tree.png",
          "caption": null,
          "width": "0.9\\linewidth",
          "placement": "below_part_text",
          "column": "full"
        }
      ],
      "workspace": [
        {
          "type": "blank",
          "height_cm": 1.0
        }
      ]
    },
    {
      "id": "b1_2",
      "text": "Wilma mag kein Marzipan. Berechnen Sie die Wahrscheinlichkeit dafÃ¼r, dass Wilma keine Kugel mit MarzipanfÃ¼llung gegessen hat.",
      "points": 2,
      "workspace": [
        {
          "type": "grid",
          "height_cm": 5,
          "grid": "karo_5mm"
        }
      ]
    },
    {
      "id": "b1_3",
      "text": "Wilma hatte GlÃ¼ck, weil in ihren beiden Kugeln kein Marzipan war. Jetzt nimmt ihr Bruder Fred eine ebenfalls zufÃ¤llig ausgewÃ¤hlte Kugel aus der Schale. Geben Sie die Wahrscheinlichkeit dafÃ¼r an, dass diese Kugel mit Marzipan gefÃ¼llt ist.",
      "points": 1,
      "workspace": [
        {
          "type": "grid",
          "height_cm": 5,
          "grid": "karo_5mm"
        }
      ]
    }
  ],
  "source": {
    "ref": "AbschlussprÃ¼fung 2025 an den Realschulen in Bayern â€“ Mathematik II â€“ Haupttermin (PDF)",
    "notes": "Aufgabengruppe B, Aufgabe B1 (Seite 6)"
  },
  "version": "1.0"
}
