{
  "$schema": "task.schema.json",
  "id": "2025_mii_ht_a2",
  "name": "Parabel mit Scheitelpunktform",
  "subject": "Mathematik",
  "topic": "Funktionen",
  "tags": [
    "abschlusspruefung",
    "realschule",
    "bayern",
    "2025",
    "parabel"
  ],
  "points": 4.5,
  "statement": "Die Parabel p mit dem Scheitelpunkt S(2|3) verlaeuft durch den Punkt P(0|1). Sie hat eine Gleichung der Form y = a*(x - x_S)^2 + y_S (a, x, y in R; a != 0).",
  "parts": [
    {
      "id": "a2_1",
      "text": "Zeigen Sie, dass gilt: a = -0,5.",
      "points": 2,
      "workspace": [
        {
          "type": "grid",
          "height_cm": 5,
          "grid": "karo_5mm"
        }
      ]
    },
    {
      "id": "a2_2",
      "text": "Zeichnen Sie die Parabel p fuer x in [-1; 5] in das Koordinatensystem ein.",
      "points": 1.5,
      "workspace": [
        {
          "type": "coord_grid",
          "xmin": -6,
          "xmax": 6,
          "ymin": -2,
          "ymax": 7,
          "unit_cm": 1.0,
          "grid": "karo_5mm"
        }
      ]
    },
    {
      "id": "a2_3",
      "text": "Kreuzen Sie an, welche Gleichung ebenfalls die Parabel p beschreibt.\n[ ] y = 0,5x^2 + 2x + 3\n[ ] y = -0,5x^2 + 2x + 3\n[ ] y = 0,5x^2 + 2x + 1\n[ ] y = -0,5x^2 + 2x + 1",
      "points": 1,
      "workspace": [
        {
          "type": "grid",
          "height_cm": 5,
          "grid": "karo_5mm"
        }
      ]
    }
  ],
  "source": {
    "ref": "Abschlusspruefung 2025 an den Realschulen in Bayern - Mathematik II - Haupttermin (PDF)",
    "notes": "Aufgabengruppe A, Aufgabe A2 (Seite 2)"
  },
  "version": "1.0"
}
