{
  "$schema": "task.schema.json",
  "id": "2025_mii_ht_b4",
  "name": "Pyramide",
  "subject": "Mathematik",
  "topic": "Geometrie",
  "tags": [
    "abschlussprÃ¼fung",
    "realschule",
    "bayern",
    "2025",
    "geometrie",
    "pyramide",
    "volumen"
  ],
  "points": 16,
  "statement": "Die nebenstehende Skizze zeigt ein SchrÃ¤gbild der Pyramide ABCDS mit der HÃ¶he MS, deren GrundflÃ¤che das Quadrat ABCD mit dem Diagonalenschnittpunkt M ist. Es gilt: |AC| = 12 cm; |MS| = 8,5 cm. Runden Sie im Folgenden auf zwei Stellen nach dem Komma.",
  "assets": [
    {
      "path": "assets/B4_pyramid.png",
      "caption": null,
      "width": "0.42\\linewidth",
      "placement": "below_statement",
      "column": "full"
    }
  ],
  "parts": [
    {
      "id": "b4_1",
      "text": "Zeichnen Sie das SchrÃ¤gbild der Pyramide ABCDS, wobei die Strecke AC auf der SchrÃ¤gbildachse und der Punkt A links vom Punkt C liegen soll. FÃ¼r die Zeichnung gilt: q = 1/2; Ï‰ = 45Â°. Berechnen Sie sodann die LÃ¤nge der Strecke AS sowie das MaÃŸ des Winkels MAS. (Teilergebnisse: |AS| = 10,40 cm; âˆ MAS = 54,78Â°)",
      "points": 4,
      "workspace": [
        {
          "type": "grid",
          "height_cm": 6.0,
          "grid": "karo_5mm"
        }
      ]
    },
    {
      "id": "b4_2",
      "text": "FÃ¼r Punkte Pâ‚™ âˆˆ AS gilt: |SPâ‚™| = x cm (x âˆˆ â„; 0 â‰¤ x < 10,40). Sie sind die Spitzen von Pyramiden AMDPâ‚™ mit den HÃ¶hen Pâ‚™Hâ‚™.\nZeichnen Sie fÃ¼r x = 5 die Pyramide AMDPâ‚ und die HÃ¶he Pâ‚Hâ‚ in das SchrÃ¤gbild zu B4.1 ein. Berechnen Sie sodann die LÃ¤nge der Strecke MPâ‚ sowie den FlÃ¤cheninhalt des Dreiecks AMPâ‚.",
      "points": 4,
      "workspace": [
        {
          "type": "grid",
          "height_cm": 5,
          "grid": "karo_5mm"
        }
      ]
    },
    {
      "id": "b4_3",
      "text": "Zeigen Sie, dass fÃ¼r das Volumen der Pyramiden AMDPâ‚™ in AbhÃ¤ngigkeit von x gilt: V(x) = (âˆ’4,92x + 51,00) cmÂ³. Unter den Pyramiden AMDPâ‚™ hat die Pyramide AMDPâ‚€ das maximale Volumen. Geben Sie den zugehÃ¶rigen Wert von x sowie das maximale Volumen an.",
      "points": 4,
      "workspace": [
        {
          "type": "grid",
          "height_cm": 5,
          "grid": "karo_5mm"
        }
      ]
    },
    {
      "id": "b4_4",
      "text": "Die Pyramide AMDPâ‚‚ hat ein Volumen von 35 cmÂ³. Berechnen Sie den zugehÃ¶rigen Wert von x. Geben Sie sodann das Intervall fÃ¼r x an, so dass gilt: V(x) â‰¥ 35 cmÂ³.",
      "points": 2.5,
      "workspace": [
        {
          "type": "grid",
          "height_cm": 5,
          "grid": "karo_5mm"
        }
      ]
    },
    {
      "id": "b4_5",
      "text": "Die Höhe der Pyramide $AMDP_3$ ist halb so lang wie die Höhe der Pyramide ABCDS. Begründen Sie, weshalb das Volumen der Pyramide ABCDS achtmal so groÃŸ wie das Volumen der Pyramide AMDPâ‚ƒ ist.",
      "points": 1.5,
      "workspace": [
        {
          "type": "grid",
          "height_cm": 5,
          "grid": "karo_5mm"
        }
      ]
    }
  ],
  "source": {
    "ref": "Abschlussprüfung 2025 an den Realschulen in Bayern â€“ Mathematik II â€“ Haupttermin (PDF)",
    "notes": "Aufgabengruppe B, Aufgabe B4 (Seite 10)"
  },
  "version": "1.0"
}
